{
  "event_id": "aft:event:ap2-procurement-payment-2026-05-04-001",
  "aft_event_version": "0.1",
  "event_type": "AGENT_PAYMENT_SETTLED",
  "event_time": "2026-05-04T14:25:00Z",
  "agent_id": "aft:agent:procurement-agent-009",
  "principal_id": "aft:principal:acme-corp",
  "operator_id": "aft:operator:acme-runtime",
  "counterparty_id": "aft:counterparty:software-merchant-example",
  "transaction": {
    "transaction_id": "ap2-payment-2026-05-04-001",
    "transaction_type": "PAYMENT",
    "status": "SETTLED",
    "amount": {
      "value": "1250.00",
      "currency": "USD"
    },
    "asset_type": "FIAT",
    "payment_protocol": "AP2",
    "rail_ref": "card-network-tokenized-payment",
    "settlement_id": "processor-settlement-2026-05-04-091",
    "purpose_code": "SOFTWARE_PROCUREMENT",
    "external_refs": [
      "ap2:intent-mandate:hash-001",
      "ap2:cart-mandate:hash-001",
      "ap2:payment-mandate:hash-001"
    ]
  },
  "authority": {
    "mandate_id": "aft:mandate:ap2-payment-2026-05-04-001",
    "mandate_type": "AP2_PAYMENT_MANDATE",
    "mandate_hash": "sha256:1212121212121212121212121212121212121212121212121212121212121212",
    "principal_id": "aft:principal:acme-corp",
    "agent_id": "aft:agent:procurement-agent-009",
    "authorized": true,
    "scope": [
      "software.procurement",
      "merchant.software-approved"
    ],
    "amount_limit": {
      "value": "1500.00",
      "currency": "USD"
    },
    "expires_at": "2026-05-05T00:00:00Z",
    "nonce": "ap2nonce001",
    "policy_ref": "policy:acme:procurement:v8"
  },
  "evidence": {
    "evidence_type": "MANDATE",
    "evidence_hashes": [
      "sha256:1313131313131313131313131313131313131313131313131313131313131313",
      "sha256:1414141414141414141414141414141414141414141414141414141414141414"
    ],
    "evidence_uri": "urn:aft:evidence:ap2-procurement-payment-001",
    "receipt_hash": "sha256:1515151515151515151515151515151515151515151515151515151515151515",
    "external_evidence_refs": [
      "ap2:payment-receipt:001"
    ],
    "redaction_status": "SELECTIVE_DISCLOSURE"
  },
  "privacy": {
    "classification": "RESTRICTED",
    "pii_present": false,
    "on_chain_disclosure": [
      "EVENT_HASH",
      "MERKLE_ROOT"
    ],
    "selective_disclosure": true,
    "retention_policy": "retain procurement evidence under enterprise retention policy; anchor commitments only"
  },
  "crypto": {
    "canonicalization": "JCS-RFC8785",
    "digest_alg": "SHA-384",
    "event_hash": "sha384:161616161616161616161616161616161616161616161616161616161616161616161616161616161616161616161616",
    "pqc_profile": "AFT-PQC-2",
    "signature_input": "AFT-EVENT-DRAFT-0.1:event-without-signature-values"
  },
  "signatures": [
    {
      "alg": "aft-sig-hybrid-ecdsa-ml-dsa",
      "kid": "aft-key-procurement-agent-hybrid-v1",
      "key_version": 1,
      "pqc_profile": "AFT-PQC-2",
      "signature_value": "HybridECDSAMLDSASignatureExample001",
      "signature_created_at": "2026-05-04T14:25:01Z",
      "signature_expires_at": "2027-05-04T14:25:01Z",
      "verification_method": "did:web:agents.example:procurement-agent-009#hybrid-v1"
    }
  ],
  "correlation": {
    "correlation_id": "corr-ap2-procurement-001",
    "external_reference_ids": [
      "ap2:workflow:procurement-001"
    ],
    "workflow_id": "workflow:ap2-procurement-001"
  }
}
