{
  "event_id": "aft:event:hybrid-payment-authorized-2026-05-04-001",
  "aft_event_version": "0.1",
  "event_type": "AGENT_PAYMENT_AUTHORIZED",
  "event_time": "2026-05-04T18:30:00Z",
  "agent_id": "aft:agent:search-buyer-001",
  "principal_id": "aft:principal:acme-corp",
  "operator_id": "aft:operator:acme-runtime",
  "counterparty_id": "aft:counterparty:model-api-example",
  "transaction": {
    "transaction_id": "hybrid-auth-001",
    "transaction_type": "PAYMENT",
    "status": "AUTHORIZED",
    "amount": {
      "value": "3.00",
      "currency": "USD"
    },
    "asset_type": "FIAT",
    "payment_protocol": "OTHER",
    "rail_ref": "processor-authorization-reference",
    "purpose_code": "MODEL_API_USAGE"
  },
  "authority": {
    "mandate_id": "aft:mandate:model-api-budget-2026-05",
    "mandate_type": "AUTONOMOUS_BUDGET",
    "mandate_hash": "sha256:3131313131313131313131313131313131313131313131313131313131313131",
    "principal_id": "aft:principal:acme-corp",
    "agent_id": "aft:agent:search-buyer-001",
    "authorized": true,
    "scope": [
      "model-api.usage"
    ],
    "amount_limit": {
      "value": "500.00",
      "currency": "USD"
    },
    "expires_at": "2026-06-01T00:00:00Z",
    "nonce": "hybridnonce001",
    "policy_ref": "policy:acme:model-api-budget:v1"
  },
  "evidence": {
    "evidence_type": "RECEIPT",
    "evidence_hashes": [
      "sha256:3535353535353535353535353535353535353535353535353535353535353535"
    ],
    "evidence_uri": "urn:aft:evidence:hybrid-signed-event-001",
    "receipt_hash": "sha256:3636363636363636363636363636363636363636363636363636363636363636",
    "redaction_status": "HASH_ONLY"
  },
  "privacy": {
    "classification": "HASH_ONLY",
    "pii_present": false,
    "on_chain_disclosure": [
      "EVENT_HASH",
      "MERKLE_ROOT"
    ],
    "selective_disclosure": true,
    "retention_policy": "hash-only public disclosure; authorization receipt retained off-chain"
  },
  "crypto": {
    "canonicalization": "JCS-RFC8785",
    "digest_alg": "SHA-384",
    "event_hash": "sha384:373737373737373737373737373737373737373737373737373737373737373737373737373737373737373737373737",
    "pqc_profile": "AFT-PQC-2",
    "signature_input": "AFT-EVENT-DRAFT-0.1:event-without-signature-values"
  },
  "signatures": [
    {
      "alg": "aft-sig-hybrid-ed25519-ml-dsa",
      "kid": "aft-key-search-buyer-hybrid-v1",
      "key_version": 1,
      "pqc_profile": "AFT-PQC-2",
      "signature_value": "HybridEd25519MLDSASignatureExample001",
      "signature_created_at": "2026-05-04T18:30:01Z",
      "verification_method": "did:web:agents.example:search-buyer-001#hybrid-v1"
    }
  ]
}
