{
  "event_id": "aft:event:security-incident-2026-05-04-001",
  "aft_event_version": "0.1",
  "event_type": "AGENT_SECURITY_INCIDENT_REPORTED",
  "event_time": "2026-05-04T15:00:00Z",
  "agent_id": "aft:agent:procurement-agent-009",
  "principal_id": "aft:principal:acme-corp",
  "operator_id": "aft:operator:acme-runtime",
  "counterparty_id": "aft:counterparty:security-provider-example",
  "transaction": {
    "transaction_id": "incident-report-2026-05-04-001",
    "transaction_type": "INCIDENT",
    "status": "REPORTED",
    "asset_type": "NON_MONETARY",
    "payment_protocol": "NONE",
    "purpose_code": "SECURITY_INCIDENT_REPORT"
  },
  "authority": {
    "mandate_id": "aft:mandate:incident-report-authority-2026",
    "mandate_type": "CUSTOM",
    "mandate_hash": "sha256:1717171717171717171717171717171717171717171717171717171717171717",
    "principal_id": "aft:principal:acme-corp",
    "agent_id": "aft:agent:procurement-agent-009",
    "authorized": true,
    "scope": [
      "security.incident-reporting"
    ],
    "expires_at": "2026-12-31T23:59:59Z",
    "nonce": "incidentnonce001",
    "policy_ref": "policy:acme:security-incident-reporting:v2"
  },
  "evidence": {
    "evidence_type": "INCIDENT",
    "evidence_hashes": [
      "sha256:1818181818181818181818181818181818181818181818181818181818181818"
    ],
    "evidence_uri": "urn:aft:evidence:encrypted-incident-report-001",
    "external_evidence_refs": [
      "case:security-provider:2026-05-04-001"
    ],
    "redaction_status": "HASH_ONLY"
  },
  "privacy": {
    "classification": "RESTRICTED",
    "pii_present": false,
    "on_chain_disclosure": [
      "EVENT_HASH",
      "REVOCATION_ROOT"
    ],
    "selective_disclosure": true,
    "retention_policy": "restricted incident evidence retained off-chain with access logging"
  },
  "crypto": {
    "canonicalization": "JCS-RFC8785",
    "digest_alg": "SHA-384",
    "event_hash": "sha384:191919191919191919191919191919191919191919191919191919191919191919191919191919191919191919191919",
    "pqc_profile": "AFT-PQC-3",
    "signature_input": "AFT-EVENT-DRAFT-0.1:event-without-signature-values"
  },
  "signatures": [
    {
      "alg": "aft-sig-ml-dsa",
      "kid": "aft-key-procurement-agent-ml-dsa-v2",
      "key_version": 2,
      "pqc_profile": "AFT-PQC-3",
      "signature_value": "MLDSASignatureValueForIncidentExample001",
      "signature_created_at": "2026-05-04T15:00:02Z",
      "verification_method": "did:web:agents.example:procurement-agent-009#ml-dsa-v2"
    }
  ],
  "correlation": {
    "correlation_id": "corr-security-incident-001",
    "workflow_id": "workflow:security-case-001"
  }
}
